{
  "summary": "Initial evidence-based evaluation of LuxGrid UI.",
  "scores": {
    "architecture": 5,
    "security": 5,
    "product": 5,
    "team": 5,
    "gtm": 5
  },
  "evidence": {
    "architecture": [
      { "file": "README.md", "lines": [21, 27], "snippet": "Technical Stack: React, Tailwind, Storybook, Jest, Vite" }
    ],
    "security": [
      { "file": "package.json", "lines": [1, 34], "snippet": "No security-related deps yet" }
    ],
    "product": [
      { "file": "README.md", "lines": [7, 17], "snippet": "Vision and Brand DNA" }
    ],
    "team": [
      { "file": "LICENSE", "lines": [1, 22], "snippet": "MIT License implies open-source posture" }
    ],
    "gtm": [
      { "file": "README.md", "lines": [30, 36], "snippet": "Next Steps outlines setup tasks" }
    ]
  },
  "executionPlan": {
    "immediate": [
      {
        "title": "Add CI workflow with lint/test/build",
        "files": [".github/workflows/ci.yml"],
        "expectedROI": "Catches issues early; investor confidence",
        "effort": 2,
        "risk": "Low",
        "eta": "2 days",
        "acceptanceCriteria": "CI runs on PR with lint/test/build passing"
      }
    ],
    "sprint1": [
      {
        "title": "Add base components and Storybook",
        "files": ["src/components/Button.tsx", ".storybook/main.ts"],
        "expectedROI": "Demoable UI library",
        "effort": 3,
        "risk": "Medium",
        "eta": "5 days",
        "acceptanceCriteria": "Storybook shows Button with a11y checks"
      }
    ],
    "sprint2": [
      {
        "title": "Bundle size monitoring",
        "files": ["package.json"],
        "expectedROI": "Performance guardrails",
        "effort": 2,
        "risk": "Low",
        "eta": "3 days",
        "acceptanceCriteria": "Size-limit check <50KB passes"
      }
    ],
    "future": [
      {
        "title": "Multi-brand theming via CSS variables",
        "files": ["tokens/", "src/styles.css"],
        "expectedROI": "Enterprise readiness",
        "effort": 4,
        "risk": "Medium",
        "eta": "10 days",
        "acceptanceCriteria": "Two themes switchable at runtime"
      }
    ]
  },
  "stakeholderDeliverables": {
    "developers": [
      { "file": "README.md", "line": 30, "todo": "Create src/components and Button.tsx" }
    ],
    "product": [
      { "feature": "Accessible Button", "impact": "Improves usability and demoability" }
    ],
    "investors": [
      { "scriptStep": "Open Storybook and show Button variants", "wow": "Polished UX with a11y", "advantage": "Accelerated design consistency" }
    ],
    "operations": [
      "Add CI with lint/test/build",
      "Set up release workflow"
    ]
  },
  "validationGate": {
    "performance": true,
    "security": true,
    "build": true,
    "deploy": false,
    "goNoGo": "Go"
  },
  "qualityEnforcement": {
    "specificity": true,
    "evidence": true,
    "measurability": true,
    "actionability": true
  }
}
